{
  "schema_version": 1,
  "operation": "company-discover",
  "created_at": "2026-08-06T19:15:00Z",
  "changes": [
    {
      "company_id": "new-example-ai",
      "name": "New Example AI",
      "website_url": "https://new-example.com/",
      "primary_domain": "new-example.com",
      "jobs_url": "https://jobs.ashbyhq.com/new-example-ai",
      "ats": {
        "provider": "ashby",
        "board_id": "new-example-ai"
      },
      "map_location": {
        "city": "San Francisco",
        "region": "CA",
        "country": "US",
        "address": null,
        "postal_code": null,
        "latitude": null,
        "longitude": null,
        "status": "pending",
        "location_type": null,
        "source_label": null,
        "source_url": null,
        "checked_at": null
      },
      "jobs": [
        {
          "job_id": "new-example-job-123",
          "title": "Senior AI Product Engineer",
          "url": "https://jobs.ashbyhq.com/new-example-ai/new-example-job-123",
          "location_text": "San Francisco, CA",
          "workplace_arrangement": "hybrid",
          "employment_type": "full-time",
          "seniority": "senior",
          "compensation": {
            "minimum": 180000,
            "maximum": 225000,
            "currency": "USD",
            "basis": "base",
            "period": "year",
            "source_text": "$180,000-$225,000 base salary"
          },
          "posted_date": null,
          "status": "active",
          "verified_at": "2026-08-06T19:15:00Z",
          "evidence": {
            "active_status": "The role appears on the company's current official ATS board.",
            "location": "The official posting identifies San Francisco, California.",
            "workplace_arrangement": "The official posting describes a hybrid schedule.",
            "compensation": "The official posting publishes a $180,000-$225,000 base salary range.",
            "employment_type": "The official posting identifies the role as full-time.",
            "seniority": "The official title and required experience support senior level.",
            "role_fit": "The role builds AI-powered product experiences with product and design partners."
          }
        }
      ],
      "discovered_at": "2026-08-06T19:15:00Z",
      "last_verified_at": "2026-08-06T19:15:00Z"
    }
  ],
  "issues": []
}
