{
  "schema_version": 1,
  "operation": "company-discover",
  "created_at": "2026-08-07T23:50:00Z",
  "changes": [
    {
      "company_id": "floot",
      "name": "Floot",
      "website_url": "https://floot.com/",
      "primary_domain": "floot.com",
      "jobs_url": "https://www.ycombinator.com/companies/floot/jobs",
      "ats": {
        "provider": "unknown",
        "board_id": null
      },
      "map_location": {
        "city": "San Francisco",
        "region": "CA",
        "country": "US",
        "address": null,
        "postal_code": null,
        "latitude": null,
        "longitude": null,
        "status": "pending",
        "location_type": null,
        "source_label": null,
        "source_url": null,
        "checked_at": null
      },
      "jobs": [
        {
          "job_id": null,
          "title": "Founding Full-Stack Engineer",
          "url": "https://www.ycombinator.com/companies/floot/jobs/2rbWibL-founding-full-stack-engineer",
          "location_text": "San Francisco, CA, US",
          "workplace_arrangement": "on-site",
          "employment_type": "full-time",
          "seniority": "mid-level",
          "compensation": {
            "minimum": 150000,
            "maximum": 220000,
            "currency": "USD",
            "basis": "base",
            "period": "year",
            "source_text": "$150K - $220K"
          },
          "posted_date": null,
          "status": "active",
          "verified_at": "2026-08-07T23:50:00Z",
          "evidence": {
            "active_status": "Listed as active on Y Combinator Work at a Startup (ycombinator.com/companies/floot/jobs); direct application available with signup_job_id=82610.",
            "location": "San Francisco, CA, US per official YC WaaS posting.",
            "workplace_arrangement": "On-site — SF-only per official YC WaaS posting.",
            "compensation": "$150K - $220K•0.25% - 2.00%",
            "employment_type": "Full-time per official YC WaaS posting.",
            "seniority": "3+ years of experience required per official YC WaaS posting; $150K–$220K base floor supports mid-level.",
            "role_fit": "Improve the AI runtime to handle edge cases and make the agentic system more reliable; prompt engineering and evals to improve AI output quality (for both function and design); ship full-stack features on an AI-first platform that enables non-coders to build full-stack web apps via an AI-optimized framework."
          }
        }
      ],
      "discovered_at": "2026-08-07T23:50:00Z",
      "last_verified_at": "2026-08-07T23:50:00Z"
    },
    {
      "company_id": "cardinal",
      "name": "Cardinal",
      "website_url": "https://trycardinal.com/",
      "primary_domain": "trycardinal.com",
      "jobs_url": "https://www.ycombinator.com/companies/trycardinal-ai/jobs",
      "ats": {
        "provider": "unknown",
        "board_id": null
      },
      "map_location": {
        "city": "San Francisco",
        "region": "CA",
        "country": "US",
        "address": null,
        "postal_code": null,
        "latitude": null,
        "longitude": null,
        "status": "pending",
        "location_type": null,
        "source_label": null,
        "source_url": null,
        "checked_at": null
      },
      "jobs": [
        {
          "job_id": null,
          "title": "Founding Engineer",
          "url": "https://www.ycombinator.com/companies/trycardinal-ai/jobs/vLd6N4I-founding-engineer",
          "location_text": "San Francisco, CA, US",
          "workplace_arrangement": "on-site",
          "employment_type": "full-time",
          "seniority": "mid-level",
          "compensation": {
            "minimum": 200000,
            "maximum": 250000,
            "currency": "USD",
            "basis": "base",
            "period": "year",
            "source_text": "$200K - $250K"
          },
          "posted_date": null,
          "status": "active",
          "verified_at": "2026-08-07T23:50:00Z",
          "evidence": {
            "active_status": "Listed as active on Y Combinator Work at a Startup (ycombinator.com/companies/trycardinal-ai/jobs); direct application available with signup_job_id=92369.",
            "location": "San Francisco, CA, US per official YC WaaS posting.",
            "workplace_arrangement": "On-site (in-person SF office) per official YC WaaS posting.",
            "compensation": "$200K - $250K•1.00%",
            "employment_type": "Full-time per official YC WaaS posting.",
            "seniority": "1–6 years of experience per official YC WaaS posting; $200K minimum base confirms at least mid-level.",
            "role_fit": "Build AI agents that discover hyper-targeted leads by analyzing ICPs, conference attendees, and hiring signals; implement real-time content monitoring systems tracking prospect activity across social platforms; architect multi-channel sequence orchestration across email and LinkedIn; work with LLMs and prompt engineering to generate personalized outreach snippets. Experience with AI/ML, LLMs, prompt engineering, or building AI agents noted as bonus."
          }
        }
      ],
      "discovered_at": "2026-08-07T23:50:00Z",
      "last_verified_at": "2026-08-07T23:50:00Z"
    }
  ],
  "issues": []
}
